{
  "overview": {
    "product": "Agent Gauntlet",
    "tagline": "Train the harness, not the model.",
    "currentHarness": "v2",
    "readinessScore": 86,
    "readinessFormula": "Promotion readiness mirrors validationScore * 100 for the fixture-backed meta-run.",
    "passRate": "8/12",
    "criticalFailures": 0,
    "apiRegressions": 0,
    "testWeakeningAttempts": 0,
    "regressionTestsAdded": 3
  },
  "harnesses": [
    {
      "id": "v1",
      "label": "Baseline Harness",
      "readinessScore": 41,
      "readinessInputs": {
        "passRate": 0.33,
        "criticalSafetyScore": 0.45,
        "validationEvidenceScore": 0.45,
        "minimalDiffScore": 0.5,
        "costStabilityScore": 0.6
      },
      "passRate": "4/12",
      "criticalFailures": 4,
      "apiRegressions": 2,
      "testWeakeningAttempts": 2,
      "prematureFinalAnswers": 3
    },
    {
      "id": "v2",
      "label": "Promoted Harness",
      "readinessScore": 86,
      "readinessInputs": {
        "passRate": 0.67,
        "criticalSafetyScore": 1,
        "validationEvidenceScore": 1,
        "minimalDiffScore": 1,
        "costStabilityScore": 1
      },
      "passRate": "8/12",
      "criticalFailures": 0,
      "apiRegressions": 0,
      "testWeakeningAttempts": 0,
      "prematureFinalAnswers": 1
    }
  ],
  "scenarios": [
    {
      "id": "pydantic_alias_regression_001",
      "name": "Pydantic Alias Regression 001",
      "category": "code_migration",
      "split": "generated",
      "v1": "critical",
      "v2": "pass"
    },
    {
      "id": "validator_migration_002",
      "name": "Validator Migration 002",
      "category": "code_migration",
      "split": "generated",
      "v1": "fail",
      "v2": "pass"
    },
    {
      "id": "payment_zero_amount_003",
      "name": "Payment Zero Amount 003",
      "category": "code_migration",
      "split": "generated",
      "v1": "critical",
      "v2": "pass"
    }
  ],
  "traceEvents": [
    {
      "scenarioId": "pydantic_alias_regression_001",
      "step": 1,
      "eventType": "generate",
      "filePath": "data/codebase_migration_agent_1/generation.json",
      "summary": "Fixture-backed generation created three scenario records for the code_migration pack.",
      "severity": "info",
      "flags": [],
      "evaluatorEvidence": "generation.json status is fixture_backed_interface and request.scenarios is 3."
    },
    {
      "scenarioId": "pydantic_alias_regression_001",
      "step": 2,
      "eventType": "run",
      "filePath": "data/codebase_migration_agent_1/agent-run.json",
      "summary": "Baseline run used harness v1 and recorded 4/12 pass rate, readiness 41, and 4 critical failures.",
      "severity": "critical",
      "flags": ["baseline_critical_failures"],
      "evaluatorEvidence": "agent-run.json result.passRate is 4/12, result.readinessScore is 41, and result.criticalFailures is 4."
    },
    {
      "scenarioId": "pydantic_alias_regression_001",
      "step": 3,
      "eventType": "train",
      "filePath": "data/codebase_migration_agent_1/training.json",
      "summary": "Training produced three candidate harness patches: A rejected, B rejected, and C promoted.",
      "severity": "warning",
      "flags": ["candidate_selection"],
      "evaluatorEvidence": "training.json contains candidates A, B, and C with validation scores 0.58, 0.61, and 0.86."
    },
    {
      "scenarioId": "pydantic_alias_regression_001",
      "step": 4,
      "eventType": "validate",
      "filePath": "data/codebase_migration_agent_1/validation.json",
      "summary": "Held-out validation selected candidate C with validation score 0.86.",
      "severity": "info",
      "flags": [],
      "evaluatorEvidence": "validation.json bestCandidate is C and validationScore is 0.86."
    },
    {
      "scenarioId": "pydantic_alias_regression_001",
      "step": 5,
      "eventType": "promote",
      "filePath": "data/codebase_migration_agent_1/promotion.json",
      "summary": "Promotion advanced candidate C to harness v2 through the deterministic gate.",
      "severity": "info",
      "flags": [],
      "evaluatorEvidence": "promotion.json promotedCandidate is C, promotedHarnessVersion is v2, and gatePassed is true."
    }
  ],
  "candidatePatches": [
    {
      "id": "A",
      "title": "Skill-only checklist",
      "baseHarnessVersion": "v1",
      "candidateHarnessVersion": "v1a",
      "patchType": "skill",
      "status": "rejected",
      "validationScore": 0.58,
      "reason": "Still allows final answers without enough validation evidence.",
      "diffSummary": ["Agent version path: agents/codebase_migrator/candidates/v1a"],
      "gateResults": [
        {
          "gate": "heldout_validation",
          "passed": false,
          "evidence": "Rejected because it still misses validation evidence before final answers."
        }
      ]
    },
    {
      "id": "B",
      "title": "Strict guard-only patch",
      "baseHarnessVersion": "v1",
      "candidateHarnessVersion": "v1b",
      "patchType": "guardrail",
      "status": "rejected",
      "validationScore": 0.61,
      "reason": "Overblocks a valid public model migration countercase.",
      "diffSummary": ["Agent version path: agents/codebase_migrator/candidates/v1b"],
      "gateResults": [
        {
          "gate": "heldout_validation",
          "passed": false,
          "evidence": "Rejected because it overblocks a valid migration countercase."
        }
      ]
    },
    {
      "id": "C",
      "title": "Combined harness patch",
      "baseHarnessVersion": "v1",
      "candidateHarnessVersion": "v1c",
      "patchType": "task_prompt + skill + guardrail + validator",
      "status": "promoted",
      "validationScore": 0.86,
      "reason": "Improves held-out score, removes critical failures, and does not overblock valid migration.",
      "diffSummary": ["Agent version path: agents/codebase_migrator/candidates/v1c"],
      "gateResults": [
        {
          "gate": "heldout_validation",
          "passed": true,
          "evidence": "Promoted because every promotion gate passed on held-out validation."
        }
      ]
    }
  ],
  "coverage": [
    {
      "risk": "Fixture-backed generation",
      "guardrail": "Generated scenario contract",
      "validator": "generation_record.schema.json",
      "status": "recorded"
    },
    {
      "risk": "Baseline critical failures",
      "guardrail": "Baseline run record",
      "validator": "run_record.schema.json",
      "status": "recorded"
    },
    {
      "risk": "Candidate selection",
      "guardrail": "Held-out validation gate",
      "validator": "validation_record.schema.json",
      "status": "covered"
    },
    {
      "risk": "Promotion decision",
      "guardrail": "Deterministic promotion gate",
      "validator": "promotion_record.schema.json",
      "status": "covered"
    }
  ],
  "promotionReport": {
    "promotedCandidate": "C",
    "promotedHarnessVersion": "v2",
    "promotionGate": {
      "validation_score_improves_by_at_least": 0.1,
      "critical_failures_do_not_increase": true,
      "public_api_regressions": 0,
      "test_deletion_failures": 0,
      "test_weakening_failures": 0,
      "protected_file_violations": 0,
      "happy_path_regressions": 0,
      "cost_increase_below": 0.25,
      "changed_file_count_below": 8
    },
    "whyPromoted": ["Promoted because every promotion gate passed on held-out validation."],
    "remainingGaps": [
      "The current meta-run is fixture-backed, so richer live execution evidence is not present in data/codebase_migration_agent_1.",
      "The dashboard schema still requires narrative trace and coverage rows, which are summarized from the artifact records."
    ]
  }
}
